不動産,ふどうさん,Real estate,<ruby>不動産<rt>ふどうさん</rt></ruby><ruby>業界<rt>ぎょうかい</rt></ruby>は今、<ruby>景気<rt>けいき</rt></ruby>が<ruby>良<rt>よ</rt></ruby>いです。,The real estate industry is currently doing well.
賃貸,ちんたい,Rent/lease,この<ruby>賃貸<rt>ちんたい</rt></ruby>マンションは<ruby>最先端<rt>さいせんたん</rt></ruby>の<ruby>設備<rt>せつび</rt></ruby>と<ruby>都心<rt>としん</rt></ruby>へのアクセスが<ruby>良好<rt>りょうこう</rt></ruby>で、ビジネスパーソンに<ruby>人気<rt>にんき</rt></ruby>があります。,This rental apartment is popular among business people for its state-of-the-art facilities and good access to the city center.
賃貸契約,ちんたいけいやく,Rental agreement/lease contract,<ruby>賃貸<rt>ちんたい</rt></ruby><ruby>契約<rt>けいやく</rt></ruby>を<ruby>更新<rt>こうしん</rt></ruby>する<ruby>必要<rt>ひつよう</rt></ruby>があります。,I need to renew my rental agreement.
物件,ぶっけん,Property,その<ruby>物件<rt>ぶっけん</rt></ruby>は<ruby>駅<rt>えき</rt></ruby>から<ruby>近<rt>ちか</rt></ruby>いです。,That property is close to the station.
アパート,アパート,Apartment,<ruby>新<rt>あたら</rt><ruby>しいアパートに<ruby>引<rt>ひ</rt></ruby>っ<ruby>越<rt>こ</rt></ruby>しました。,I moved into a new apartment.
マンション,マンション,Condominium/Apartment building,<ruby>彼<rt>かれ</rt></ruby>は<ruby>都心<rt>としん</rt></ruby>のマンションに<ruby>住<rt>す</rt></ruby>んでいます。,He lives in a condominium in the city center.
一戸建て,いっこだて,Detached house,<ruby>家族<rt>かぞく</rt></ruby>で<ruby>一戸建<rt>いっこだて</rt></ruby>てを<ruby>購入<rt>こうにゅう</rt></ruby>しました。,We bought a detached house with my family.
部屋,へや,Room,この<ruby>部屋<rt>へや</rt></ruby>はとても<ruby>広<rt>ひろ</rt></ruby>いです。,This room is very spacious.
家賃,やちん,Rent,<ruby>家賃<rt>やちん</rt></ruby>は<ruby>毎月<rt>まいつき</rt></ruby><ruby>初<rt>はじ</rt></ruby>めに<ruby>支払<rt>しはら</rt></ruby>います。,Rent is paid at the beginning of each month.
礼金,れいきん,Key money,この<ruby>物件<rt>ぶっけん</rt></ruby>は<ruby>礼金<rt>れいきん</rt></ruby>が<ruby>不要<rt>ふよう</rt></ruby>です。,This property does not require key money.
敷金,しききん,Security deposit,アパートを<ruby>借<rt>か</rt></ruby>りる<ruby>際<rt>さい</rt></ruby>には<ruby>敷金<rt>しききん</rt></ruby>が<ruby>必要<rt>ひつよう</rt></ruby>です。,A security deposit is required when renting an apartment.
管理費,かんりひ,Maintenance fee,<ruby>毎月<rt>まいつき</rt></ruby>の<ruby>管理費<rt>かんりひ</rt></ruby>は<ruby>高<rt>たか</rt></ruby>くありません。,The monthly maintenance fee is not expensive.
共益費,きょうえきひ,Common service fee,<ruby>共益費<rt>きょうえきひ</rt></ruby>にはエレベーターの<ruby>費用<rt>ひよう</rt></ruby>が<ruby>含<rt>ふく</rt></ruby>まれています。,The common service fee includes the cost of the elevator.
仲介手数料,ちゅうかいてすうりょう,Agency fee,<ruby>新<rt>あたら</rt></ruby>しい<ruby>部屋<rt>へや</rt></ruby>を<ruby>探<rt>さが</rt></ruby>すのに<ruby>仲介手数料<rt>ちゅうかいてすうりょう</rt></ruby>がかかります。,An agency fee is charged for finding a new room.
更新料,こうしんりょう,Renewal fee,<ruby>契約<rt>けいやく</rt></ruby><ruby>更新<rt>こうしん</rt></ruby>の<ruby>際<rt>さい</rt></ruby>には<ruby>更新料<rt>こうしんりょう</rt></ruby>が<ruby>必要<rt>ひつよう</rt></ruby>です。,A renewal fee is required when renewing the contract.
入居日,にゅうきょび,Move-in date,<ruby>入居日<rt>にゅうきょび</rt></ruby>は<ruby>来月<rt>らいげつ</rt></ruby>の<ruby>一日<rt>ついたち</rt></ruby>です。,The move-in date is the first of next month.
退去,たいきょ,Move-out,<ruby>退去<rt>たいきょ</rt></ruby>は<ruby>事前<rt>じぜん</rt></ruby>に<ruby>通知<rt>つうち</rt></ruby>が<ruby>必要<rt>ひつよう</rt></ruby>です。,Advance notice is required for moving out.
住民票,じゅうみんひょう,Certificate of residence,<ruby>住民票<rt>じゅうみんひょう</rt></ruby>を<ruby>市役所<rt>しやくしょ</rt></ruby>で<ruby>取得<rt>しゅとく</rt></ruby>しました。,I obtained my certificate of residence at the city hall.
間取り,まどり,Floor plan/layout,このアパートの<ruby>間取<rt>まど</rt></ruby>りはとても<ruby>便利<rt>べんり</rt></ruby>です。,The floor plan of this apartment is very convenient.
築年数,ちくねんすう,Age of a building,このビル</ruby>の<ruby>築年数<rt>ちくねんすう</rt></ruby>は<ruby>10年<rt>じゅうねん</rt></ruby>です。,The age of this building is 10 years.
日当たり,ひあたり,Sun exposure,<ruby>私<rt>わたし</rt></ruby>の<ruby>部屋<rt>へや</rt></ruby>は<ruby>日当<rt>ひあ</rt></ruby>たりが<ruby>良<rt>よ</rt></ruby>いです。,My room has good sun exposure.
駐車場,ちゅうしゃじょう,Parking lot,このマンションには<ruby>専用<rt>せんよう</rt></ruby><ruby>駐車場<rt>ちゅうしゃじょう</rt></ruby>があります。,This apartment building has a private parking lot.
ペット可,ぺっとか,Pets-allowed,この<ruby>物件<rt>ぶっけん</rt></ruby>はペット<ruby>可<rt>か</rt></ruby>です。,This property allows pets.
近隣,きんりん,Neighborhood,<ruby>近隣<rt>きんりん</rt></ruby>にはスーパーや<ruby>学校<rt>がっこう</rt></ruby>があります。,There are supermarkets and schools in the neighborhood.
大家,おおや,Landlord,この<ruby>地区<rt>ちく</rt></ruby>では、<ruby>大家<rt>おおや</rt></ruby>さんが<ruby>地域<rt>ちいき</rt></ruby>の<ruby>清掃<rt>せいそう</rt></ruby><ruby>活動<rt>かつどう</rt></ruby>を<ruby>積極的<rt>せっきょくてき</rt></ruby>に<ruby>推進<rt>すいしん</rt></ruby>しています。,"In this area, the landlords are actively promoting neighborhood clean-up activities."
入居者,にゅうきょしゃ,Tenant,<ruby>新<rt>あたら</rt></ruby>しい<ruby>入居者<rt>にゅうきょしゃ</rt></ruby>が<ruby>今月<rt>こんげつ</rt></ruby>から<ruby>住<rt>す</rt></ruby>み<ruby>始<rt>はじ</rt></ruby>めます。,The new tenant will start living here from this month.
空室,くうしつ,Vacant room,この<ruby>ビル<rt>びる</rt></ruby>には<ruby>幾<rt>いく</rt></ruby>つか<ruby>空室<rt>くうしつ</rt></ruby>があります。,There are several vacant rooms in this building.
管理会社,かんりがいしゃ,Management company,<ruby>管理会社<rt>かんりがいしゃ</rt></ruby>が<ruby>建物<rt>たてもの</rt></ruby>の<ruby>メンテナンス<rt>めんてなんす</rt></ruby>を<ruby>行<rt>おこな</rt></ruby>います。,The management company handles the maintenance of the building.
契約期間,けいやくきかん,Contract period,<ruby>契約<rt>けいやく</rt></ruby><ruby>期間<rt>きかん</rt></ruby>は<ruby>2年間<rt>にねんかん</rt></ruby>です。,The contract period is two years.
住宅ローン,じゅうたくローン,Mortgage,<ruby>住宅<rt>じゅうたく</rt></ruby><ruby>ローン<rt>ろーん</rt></ruby>を<ruby>組<rt>く</rt></ruby>んで<ruby>家<rt>いえ</rt></ruby>を<ruby>買<rt>か</rt></ruby>いました。,I bought a house with a mortgage.
物件情報,ぶっけんじょうほう,Property information,<ruby>不動産<rt>ふどうさん</rt></ruby><ruby>サイト<rt>さいと</rt></ruby>で<ruby>物件<rt>ぶっけん</rt></ruby><ruby>情報<rt>じょうほう</rt></ruby>を<ruby>確認<rt>かくにん</rt></ruby>しました。,I checked the property information on the real estate website.
内見,ないけん,Property viewing/inspection,<ruby>明日<rt>あした</rt></ruby>、アパートの<ruby>内見<rt>ないけん</rt></ruby>に<ruby>行<rt>い</rt></ruby>きます。,I will go view the apartment tomorrow.
即入居,そくにゅうきょ,Available immediately,この<ruby>部屋<rt>へや</rt></ruby>は<ruby>即<rt>そく</rt></ruby><ruby>入居<rt>にゅうきょ</rt></ruby><ruby>可能<rt>かのう</rt></ruby>です。,This room is available immediately.
新築,しんちく,Newly built,<ruby>新築<rt>しんちく</rt></ruby>の<ruby>住宅<rt>じゅうたく</rt></ruby>には、<ruby>最新<rt>さいしん</rt></ruby>のエコフレンドリーな<ruby>技術<rt>ぎじゅつ</rt></ruby>が<ruby>導入<rt>どうにゅう</rt></ruby>され、<ruby>住<rt>す</rt></ruby>む<ruby>人<rt>ひと</rt></ruby>の<ruby>生活<rt>せいかつ</rt></ruby>をより<ruby>快適<rt>かいてき</rt></ruby>にしています。,"The newly constructed houses incorporate the latest eco-friendly technologies, making life more comfortable for residents."
中古,ちゅうこ,Pre-owned,この<ruby>中古<rt>ちゅうこ</rt></ruby>の<ruby>家<rt>いえ</rt></ruby>は、リフォーム<ruby>済<rt>ず</rt></ruby>みで<ruby>新築<rt>しんちく</rt></ruby><ruby>同様<rt>どうよう</rt></ruby>の<ruby>品質<rt>ひんしつ</rt></ruby>を<ruby>備<rt>そな</rt></ruby>えています。,This second-hand house has been renovated and offers quality comparable to a new build.
リノベーション,リノベーション,Renovation,リノベーション<ruby>済<rt>ず</rt></ruby>みの<ruby>物件<rt>ぶっけん</rt></ruby>を<ruby>見<rt>み</rt></ruby>に<ruby>行<rt>い</rt></ruby>きました。,I went to see a renovated property.
オートロック,オートロック,Auto-lock (security system),オートロック<ruby>付<rt>つ</rt></ruby>きのマンションに<ruby>住<rt>す</rt></ruby>んでいます。,I live in an apartment building with an auto-lock system.
バルコニー,バルコニー,Balcony,バルコニーからの<ruby>眺<rt>なが</rt></ruby>めが<ruby>素晴<rt>すば</rt></ruby>らしいです。,The view from the balcony is wonderful.
エアコン,エアコン,Air conditioner,<ruby>夏<rt>なつ</rt></ruby>はエアコンが<ruby>欠<rt>か</rt></ruby>かせません。,The air conditioner is essential in summer.
フローリング,フローリング,Wooden flooring,リビングルームはフローリングです。,The living room has wooden flooring.
ガスコンロ,ガスコンロ,Gas stove,キッチンには<ruby>新<rt>あたら</rt></ruby>しいガスコンロがあります。,There is a new gas stove in the kitchen.
IHクッキングヒーター,IHクッキングヒーター,Induction heating stove,このマンションはIHクッキングヒーターを<ruby>使用<rt>しよう</rt></ruby>しています。,This apartment uses an IH stove.
ウォークインクローゼット,ウォークインクローゼット,Walk-in closet,<ruby>主寝室<rt>しゅしんしつ</rt></ruby>にはウォークインクローゼットがあります。,The master bedroom has a walk-in closet.
洗面所,せんめんじょ,Washroom,<ruby>洗面所<rt>せんめんじょ</rt></ruby>はバスルームの<ruby>隣<rt>となり</rt></ruby>にあります。,The washroom is next to the bathroom.
浴室,よくしつ,Bathroom,この<ruby>家<rt>いえ</rt></ruby>の<ruby>浴室<rt>よくしつ</rt></ruby>はとても<ruby>広<rt>ひろ</rt></ruby>いです。,The bathroom in this house is very spacious.
洗濯機置き場,せんたくきおきば,Space for a washing machine,<ruby>洗濯機<rt>せんたくき</rt></ruby><ruby>置<rt>お</rt></ruby>き<ruby>場<rt>ば</rt></ruby>はバルコニーにあります。,The washing machine space is on the balcony.
給湯,きゅうとう,Hot water supply,<ruby>給湯<rt>きゅうとう</rt></ruby>システムが<ruby>故障<rt>こしょう</rt></ruby>しています。,The hot water supply system is broken.
インターネット接続,インターネットせつぞく,Internet connection,このマンションは<ruby>高速<rt>こうそく</rt></ruby>インターネット<ruby>接続<rt>せつぞく</rt></ruby>が<ruby>可能<rt>かのう</rt></ruby>です。,This apartment building offers high-speed internet connection.
家具付き,かぐつき,Furnished,このアパートは<ruby>家具<rt>かぐ</rt></ruby><ruby>付<rt>つ</rt></ruby>きで<ruby>貸<rt>か</rt></ruby>し<ruby>出<rt>だ</rt></ruby>されています。,This apartment is rented furnished.
角部屋,かどべや,Corner room,<ruby>角部屋<rt>かくべや</rt></ruby>は<ruby>日当<rt>ひあたり</rt></ruby>たりが<ruby>良<rt>よ</rt></ruby>いです。,The corner room has good sun exposure.
最上階,さいじょうかい,Top floor,私の<ruby>部屋<rt>へや</rt></ruby>は<ruby>最上階<rt>さいじょうかい</rt></ruby>にあります。,My room is on the top floor.
閑静な住宅街,かんせいなじゅうたくがい,Quiet residential area,この<ruby>家<rt>いえ</rt></ruby>は<ruby>閑静<rt>かんせい</rt></ruby>な<ruby>住宅街<rt>じゅうたくがい</rt></ruby>にあります。,This house is located in a quiet residential area.
防音,ぼうおん,Soundproofing,<ruby>防音<rt>ぼうおん</rt></ruby>の<ruby>部屋<rt>へや</rt></ruby>で<ruby>音楽<rt>おんがく</rt></ruby>を<ruby>練習<rt>れんしゅう</rt></ruby>しています。,I practice music in a soundproof room.
収納,しゅうのう,Storage,<ruby>収納<rt>しゅうのう</rt></ruby>スペースがたくさんあります。,There is plenty of storage space.
契約書,けいやくしょ,Contract (document),<ruby>契約書<rt>けいやくしょ</rt></ruby>にサインしました。,I signed the contract.
解約,かいやく,Cancellation of contract,<ruby>解約<rt>かいやく</rt></ruby>には<ruby>事前<rt>じぜん</rt></ruby>の<ruby>通知<rt>つうち</rt></ruby>が<ruby>必要<rt>ひつよう</rt></ruby>です。,Advance notice is required for contract cancellation.
保証人,ほしょうにん,Guarantor,<ruby>契約<rt>けいやく</rt></ruby>には<ruby>保証人<rt>ほしょうにん</rt></ruby>が<ruby>必要<rt>ひつよう</rt></ruby>です。,A guarantor is required for the contract.
連帯保証人,れんたいほしょうにん,Joint guarantor,<ruby>連帯保証人<rt>れんたいほしょうにん</rt></ruby>として<ruby>署名<rt>しょめい</rt></ruby>しました。,I signed as a joint guarantor.
火災保険,かさいほけん,Fire insurance,<ruby>火災保険<rt>かさいほけん</rt></ruby>に<ruby>加入<rt>かにゅう</rt></ruby>しています。,I have fire insurance.
住み替え,すみかえ,Moving to a new residence,<ruby>来月<rt>らいげつ</rt></ruby>、<ruby>住<rt>す</rt></ruby>み<ruby>替<rt>か</rt></ruby>えを<ruby>予定<rt>よてい</rt></ruby>しています。,I plan to move to a new residence next month.
自主管理,じしゅかんり,Self-management (property managed by the owner),このアパートは<ruby>自主管理<rt>じしゅかんり</rt></ruby>です。,This apartment is managed directly by the owner.
共用部分,きょうようぶぶん,Common areas,<ruby>共用部分<rt>きょうようぶぶん</rt></ruby>の<ruby>掃除<rt>そうじ</rt></ruby>は<ruby>管理会社<rt>かんりがいしゃ</rt></ruby>が<ruby>行<rt>おこな</rt></ruby>います。,The management company cleans the common areas.
住宅,じゅうたく,Housing/residence,<ruby>郊外<rt>こうがい</rt></ruby>の<ruby>住宅<rt>じゅうたく</rt></ruby>は、<ruby>広々<rt>ひろびろ</rt></ruby>とした<ruby>庭<rt>にわ</rt></ruby><ruby>付き<rt>つき</rt></ruby>で<ruby>家族<rt>かぞく</rt></ruby><ruby>向<rt>む</rt></ruby>けに<ruby>最適<rt>さいてき</rt></ruby>です。,"Houses in the suburbs are ideal for families, offering spacious yards."
住民,じゅうみん,Resident,この<ruby>地域<rt>ちいき</rt></ruby>の<ruby>住民<rt>じゅうみん</rt></ruby>は<ruby>親切<rt>しんせつ</rt></ruby>です。,The residents of this area are kind.
取り壊し,とりこわし,Demolition,<ruby>古<rt>ふる</rt></ruby>い<ruby>建物<rt>たてもの</rt></ruby>の<ruby>取り壊<rt>とりこわ</rt></ruby>しが<ruby>始<rt>はじ</rt></ruby>まりました。,The demolition of the old building has started.
地所,じしょ,Land/estate,その<ruby>地所<rt>じしょ</rt></ruby>は<ruby>広大<rt>こうだい</rt></ruby>です。,That estate is vast.
地価,ちか,Land value,この<ruby>地域<rt>ちいき</rt></ruby>の<ruby>地価<rt>ちか</rt></ruby>は<ruby>上昇<rt>じょうしょう</rt></ruby>しています。,The land value in this area is rising.
地域,ちいき,Area/region,<ruby>地域<rt>ちいき</rt></ruby>の<ruby>イベント<rt>いべんと</rt></ruby>に<ruby>参加<rt>さんか</rt></ruby>しました。,I participated in a local event.
路線価,ろせんか,Standard land price,<ruby>路線価<rt>ろせんか</rt></ruby>を<ruby>調<rt>しら</rt></ruby>べてから<ruby>土地<rt>とち</rt></ruby>を<ruby>購入<rt>こうにゅう</rt></ruby>しました。,I checked the standard land price before buying the land.
日割り家賃,ひわりやちん,Pro-rated rent,<ruby>今月<rt>こんげつ</rt></ruby>は<ruby>日割<rt>ひわり</rt></ruby><ruby>家賃<rt>やちん</rt></ruby>が<ruby>適用<rt>てきよう</rt></ruby>されます。,Pro-rated rent will apply this month.
法定更新,ほうていこうしん,Statutory renewal,<ruby>契約<rt>けいやく</rt></ruby>の<ruby>法定更新<rt>ほうていこうしん</rt></ruby>が<ruby>必要<rt>ひつよう</rt></ruby>です。,A statutory renewal of the contract is required.

所有権,しょゆうけん,Ownership rights,この土地の所有権を取得しました。,I acquired ownership rights to this land.
用途地域,ようとちいき,Zoning area,その地域は住宅用途地域です。,That area is zoned for residential use.
土地,とち,Land,この土地は、自然環境に恵まれ、住宅建設に最適な場所です。,"This land, blessed with a rich natural environment, is an ideal location for building a house."
建築基準法,けんちくきじゅんほう,Building standards law,この建物は建築基準法に従っています。,This building complies with the building standards law.
防災設備,ぼうさいせつび,Disaster prevention equipment,このビルには最新の防災設備があります。,This building has the latest disaster prevention equipment.
立地,りっち,Location,この店は立地が良いです。,This store has a good location.
交通の便,こうつうのべん,Transportation accessibility,交通の便が良い場所に住みたいです。,I want to live in a place with good transportation accessibility.
風通し,かぜとおし,Ventilation,この部屋は風通しが良いです。,This room has good ventilation.
眺望,ちょうぼう,View (from a property),バルコニーからの眺望が素晴らしいです。,The view from the balcony is wonderful.
契約更新,けいやくこうしん,Contract renewal,契約更新の手続きをしました。,I completed the contract renewal process.
収益物件,しゅうえきぶっけん,Investment property,収益物件としてこのビルを購入しました。,I purchased this building as an investment property.
賃料,ちんりょう,Rental fee,賃料は毎月末に支払います。,The rental fee is paid at the end of each month.
土地所有者,とちしょゆうしゃ,Landowner,土地所有者は、地域開発に積極的に参加し、街の景観を向上させています。,"The landowners are actively participating in local development, enhancing the town's landscape."
家主,やぬし,Homeowner/landlord,家主が修理を手配してくれました。,The landlord arranged for repairs.
短期賃貸,たんきちんたい,Short-term rental,短期賃貸の物件を探しています。,I am looking for a short-term rental property.
長期賃貸,ちょうきちんたい,Long-term rental,このアパートは長期賃貸が可能です。,This apartment is available for long-term rental.
下見,したみ,Preliminary inspection/site visit,物件の下見に行きました。,I went for a preliminary inspection of the property.
賃貸住宅,ちんたいじゅうたく,Rental housing,この賃貸住宅は、駅から徒歩5分という好立地で、若者や単身者に大人気です。,"This rental housing, located just a 5-minute walk from the station, is very popular among young people and singles."
賃貸物件,ちんたいぶっけん,Rental property,この賃貸物件は、最新の設備が揃っていて、ペット可という条件も魅力です。,"This rental property is equipped with the latest amenities, and the pet-friendly condition is also appealing."
居住用,きょじゅうよう,Residential use,このビルの一階は商業用で、上階は居住用に使われています。,"The first floor of this building is for commercial use, while the upper floors are for residential use."
事務所,じむしょ,Office,新しい事務所に移転しました。,We moved to a new office.
店舗,てんぽ,Store/shop,店舗の内装を改装しました。,We renovated the store's interior.
倉庫,そうこ,Warehouse,商品は倉庫に保管されています。,The products are stored in the warehouse.
警備員,けいびいん,Security guard,警備員が24時間体制で巡回しています。,The security guard patrols round the clock.
水道代,すいどうだい,Water bill,水道代が先月より高くなりました。,The water bill increased compared to last month.
電気代,でんきだい,Electricity bill,電気代を節約する方法を考えています。,I am thinking of ways to save on the electricity bill.
ガス代,ガスだい,Gas bill,冬はガス代が高くなります。,The gas bill increases in winter.
インターホン,インターホン,Intercom,玄関にインターホンが設置されています。,An intercom is installed at the entrance.
エレベーター,エレベーター,Elevator,このビルにはエレベーターがあります。,This building has an elevator.
階段,かいだん,Stairs,階段を使って5階まで上がりました。,I used the stairs to go up to the fifth floor.
二重窓,にじゅうまど,Double windows (double-pane or two separate windows),冬は二重窓が暖かいです。,Double windows are warm in winter.
屋上,おくじょう,Rooftop,屋上からの景色が素晴らしいです。,The view from the rooftop is amazing.
テラス,テラス,Terrace,テラスで朝食を楽しみました。,I enjoyed breakfast on the terrace.
ロフト,ロフト,Loft,部屋の上にロフトがあります。,There is a loft above the room.
寝室,しんしつ,Bedroom,寝室には大きなベッドがあります。,There is a large bed in the bedroom.
居間,いま,Living room,居間で映画を見ました。,I watched a movie in the living room.
食堂,しょくどう,Dining room,食堂で家族と夕食を取りました。,I had dinner with my family in the dining room.
台所,だいどころ,Kitchen,台所には最新の家電があります。,The kitchen has the latest appliances.
家電,かでん,Home appliance, 彼女は新しい家電を買うために電気屋に行きました。,She went to the electronics store to buy new appliances.
クローゼット,クローゼット,Closet,クローゼットに洋服を収納しました。,I stored my clothes in the closet.
押入れ,おしいれ,Traditional Japanese closet (built into a wall; usually with sliding doors),布団は押入れに入れています。,The futon is stored in the closet.
畳,たたみ,Tatami mat,和室には畳が敷かれています。,The Japanese-style room has tatami mats.
和室,わしつ,Japanese-style room,和室でお茶を楽しみました。,I enjoyed tea in the Japanese-style room.
洋室,ようしつ,Western-style room,洋室にはベッドがあります。,The Western-style room has a bed.
水回り,みずまわり,"Wet areas (kitchen, bathroom)",水回りのリフォームを計画しています。,I am planning a renovation of the wet areas.
リフォーム,リフォーム,Renovation,私たちは家をリフォームして、キッチンとバスルームを新しくしました。,"We renovated the house, making the kitchen and bathroom new."
照明,しょうめい,Lighting,照明を新しいLEDに変えました。,I changed the lighting to new LEDs.
冷暖房,れいだんぼう,Air conditioning and heating,この部屋は冷暖房完備です。,This room is fully equipped with air conditioning and heating.
防犯カメラ,ぼうはんカメラ,Security camera,アパートの入口と駐車場には防犯カメラが設置されており、住人の安全を確保しています。,Security cameras have been installed at the entrance and parking lot of the apartment to ensure the safety of the residents.
鍵,かぎ,Key,玄関の鍵を忘れました。,I forgot the key to the entrance.
玄関,げんかん,Entrance,玄関で靴を脱いでください。,Please take off your shoes at the entrance.
外壁,がいへき,Exterior wall,外壁を塗り替えました。,We repainted the exterior wall.
内装,ないそう,Interior decoration,内装をモダンなデザインにしました。,I updated the interior decoration to a modern design.
契約条項,けいやくじょうこう,Contract terms,契約条項をよく読んでください。,Please read the contract terms carefully.
賃借人,ちんしゃくにん,Lessee,賃借人は家賃を毎月払います。,The lessee pays the rent monthly.
